{
  "schema_version": "0",
  "mode": "B",
  "invoice_id": "e30-golden-invoice-29",
  "display_number": "E30-SYN-29",
  "operation_id": "e30-golden-operation-29",
  "device_id": "e30-golden-synthetic-device",
  "public_token": "QWJjZGVmZ2hpamtsbW5vcHFyc3R1dg",
  "store_id": "e30-golden-synthetic-store",
  "customer": {
    "phone": "+15551234567",
    "phone_status": "claimed"
  },
  "state": "EXTRACTED",
  "state_history": [
    {
      "from_state": "DRAFT",
      "to_state": "EXTRACTED",
      "operation_id": "e30-golden-operation-29",
      "device_id": "e30-golden-synthetic-device"
    }
  ],
  "line_items": [
    {
      "product_name": "Synthetic E30 item 1",
      "quantity": 1,
      "unit_price": 1450000,
      "line_total": 1450000
    },
    {
      "product_name": "Synthetic E30 item 2",
      "quantity": 1,
      "unit_price": 4870000,
      "line_total": 4870000
    },
    {
      "product_name": "Synthetic E30 item 3",
      "quantity": 1,
      "unit_price": 570000,
      "line_total": 570000
    },
    {
      "product_name": "Synthetic E30 item 4",
      "quantity": 1,
      "unit_price": 570000,
      "line_total": 570000
    }
  ],
  "summary": {
    "subtotal": 7460000,
    "extra_amounts": {},
    "payable": 7460000
  },
  "attention_cells": [],
  "header": {
    "captured_at": "2026-10-30T00:00:00Z",
    "printed_date": null,
    "printed_time": null,
    "invoice_number": null
  },
  "provenance": {
    "image_sha256": "61d6d16594ca35d622099ad5c453292d0279127ee65744ce784952b3a781586a",
    "template_library_id": "b42688770113faaba9e4024e3af66fa4eed2cb039d184daff6429e0cef047931",
    "engine_version": "pipeline-v0/0.1.0",
    "fields": {
      "invoice_id": "native",
      "display_number": "native",
      "operation_id": "native",
      "device_id": "native",
      "public_token": "native",
      "store_id": "native",
      "customer": {
        "phone": "captured",
        "phone_status": "native"
      },
      "line_items": [
        {
          "product_name": "untrusted",
          "quantity": "captured",
          "unit_price": "derived",
          "line_total": "captured"
        },
        {
          "product_name": "untrusted",
          "quantity": "captured",
          "unit_price": "derived",
          "line_total": "captured"
        },
        {
          "product_name": "untrusted",
          "quantity": "captured",
          "unit_price": "derived",
          "line_total": "captured"
        },
        {
          "product_name": "untrusted",
          "quantity": "captured",
          "unit_price": "derived",
          "line_total": "captured"
        }
      ],
      "summary": {
        "subtotal": "derived",
        "extra_amounts": {},
        "payable": "captured"
      },
      "header": {
        "captured_at": "derived",
        "printed_date": "unavailable",
        "printed_time": "unavailable",
        "invoice_number": "unavailable"
      }
    }
  }
}
